### ISSUE TITLE
Different timestamps in egress and ingress when using hw timestamping

### ISSUE THREAD

**Issue by matijaGP** [the-tcpdump-group/libpcap#1701]
Hello,

we are facing issue with hardware timestamps in pcap capture and I hope you'd be interested in sorting this out within libpcap.

Out enviroment is linux 5.15, tcpdump version 4.99.6, libpcap version 1.10.6, hw device i225, named ethCTRLPC, ip 192.168.101.45 (full env is at the end of this report).

We are using libpcap for packet capture, however problem is easily demonstrated with tcpdump.

We are doing the hardware timestamping of the incoming frames and are using PCAP_TSTAMP_ADAPTER_UNSYNCED. Out NIC's hw clock is configured in TAI, while ofcourse we would like to capture in UTC. We are applying tai offset as frames are captured and we are OK with that.

The problem is, we are capturing both directions and are having problem with egress frames. Egress frames are ofcourse timestamped with wallclock, as opposed to ingress, resulting with two different timestamps incoming. This can be demonstrated with following setup:

```
# Sync NIC's hw clock to wallclock, with TAI offset
phc2sys -s CLOCK_REALTIME -c /dev/ptp_ethCTRLPC -O 37 -m
```

```
# Check clocks (time-tool is our own app, it dumps clocks)
$ time-tool -p /dev/ptp_ethCTRLPC -g
Getting clock_boot, clock_realtime, /dev/ptp_ethCTRLPC
            host: 10:46:51.928
      clock_real: 1784026011.928338972
   ptp_ethCTRLPC: 1784026048.928346627 (real - ptp = 37.7680)
```

```
# Start ping towards this interface and use PCAP_TSTAMP_ADAPTER_UNSYNCED
$ tcpdump -nnp -s0 -j adapter_unsynced -i ethCTRLPC icmp 
tcpdump: verbose output suppressed, use -v[v]... for full protocol decode
listening on ethCTRLPC, link-type EN10MB (Ethernet), snapshot length 262144 bytes
10:49:58.163774 IP 192.168.101.156 > 192.168.101.45: ICMP echo request, id 1, seq 1700, length 64
10:49:21.163846 IP 192.168.101.45 > 192.168.101.156: ICMP echo reply, id 1, seq 1700, length 64
10:49:59.187794 IP 192.168.101.156 > 192.168.101.45: ICMP echo request, id 1, seq 1701, length 64
10:49:22.187872 IP 192.168.101.45 > 192.168.101.156: ICMP echo reply, id 1, seq 1701, length 64
10:50:00.211791 IP 192.168.101.156 > 192.168.101.45: ICMP echo request, id 1, seq 1702, length 64
10:49:23.211877 IP 192.168.101.45 > 192.168.101.156: ICMP echo reply, id 1, seq 1702, length 64
```

Observe that ingress and egress have different timestamps. Ingress is TAI (stamped by NIC), egress in UTC, stamped with kernel (wallclock).

I believe this problem could be dealt with within libpcap, and we'd like to contribute, however I dont see it without interface intervention. Before we try to propose something, we'd like to hear from you.

In case of TPACKET_V3, we can get information from kernel whether frame was SW or HW stamped, see: https://elixir.bootlin.com/linux/v7.2-rc3/source/net/packet/af_packet.c#L2396

```
ts_status = tpacket_get_timestamp(skb, &ts,
				  READ_ONCE(po->tp_tstamp) |
				  SOF_TIMESTAMPING_SOFTWARE);
status |= ts_status;

[...]

case TPACKET_V3:
	/* tp_nxt_offset,vlan are already populated above.
	 * So DONT clear those fields here
	 */
	h.h3->tp_status |= status;
```

In libpcap we could apply "shift" for SW timestamped frames (or HW), but shift would have to be communicated. What would also serve us here would be knowledge on whether frame is coming from ingress or egress.

Thanks,

Matija

```
Environment:

$ ethtool -i ethCTRLPC
driver: igc
version: 5.15.71-standard
firmware-version: 1073:8754
expansion-rom-version: 
bus-info: 0000:b9:00.0
supports-statistics: yes
supports-test: yes
supports-eeprom-access: yes
supports-register-dump: yes
supports-priv-flags: yes

$ tcpdump --version
tcpdump version 4.99.6
libpcap version 1.10.6 (64-bit time_t, with TPACKET_V3)
64-bit build, 64-bit time_t``
```

**Comment by guyharris** [comment]
Time stamps, as specified by POSIX, are "seconds since the Epoch".

That phrase should be parsed as "seconds since" followed by "the Epoch", where "the Epoch" is a point in time, labeled as 1970-01-01 00:00:00 UTC, an d "seconds since" should be read as "*non-leap* seconds that have elapsed since".. I.e., it's not "the number of seconds that have elapsed since the Epoch", it's <scare quote>seconds since the Epoch<scare quote>.

Note that UTC didn't involve leap seconds until 1972; see, for example, [the "History" section of the Wikipedia page for UTC](https://en.wikipedia.org/wiki/Coordinated_Universal_Time#History).

Note *also* that *both* UTC and TAI count *all* seconds, leap or not; they advance by one second every 9192631770 cycles of the unperturbed [ground-state](https://en.wikipedia.org/wiki/Ground_state) [hyperfine transition](https://en.wikipedia.org/wiki/Hyperfine_transition) frequency of the [Cs-133](https://en.wikipedia.org/wiki/Caesium-133) atom. If represented as year-month-day hour:minute:second, UTC sometimes goes from year-month-day 23:59:59 to year-month-day 23:59:60 rather than to 00:00:00 of the next day; I'm not sure whether TAI is ever represented in that form, but, if it is, I presume it always goes from year-month-day 23:59:59 to 00:00:00 of the next day, as TAI doesn't involve leap seconds.

Furthermore, note that POSIX time behaves *neither* like UTC *nor* like my presumption about how TAI works. Instead, time does Weird Stuff to ensure that every day is exactly 86400 seconds, regardless of what is declared in various IERS Bulletin C.

For count-of-seconds-style time, most UN\*Xes use a count of seconds, *not* including leap seconds, since the Epoch. How the "*not* including the leap seconds" is done may vary. The astute reader will note that this means that, on occasion, subtracting UN\*X time values for two events may *not* indicate how many official SI seconds (i.e, <the number of cycles of the radiation from the aforementioned hyperfine transition>/9192631770) have elapsed between the two events.

One could also have a count of seconds, *including* leap seconds, since the Epoch.

The *second* of those values can be converted to UTC, represented as year-mont-day hour:minute:second, using the "right" version of the IANA tzdb data rather than the "posix" version.

The *first* of those values can, for *most* times, be converted to UTC, represented as year-mont-day hour:minute:second, using the "posix" version of the IANA tzdb data. It cannot *always* convert to UTC because POSIX time doesn't support UTC in the vicinity of leap seconds.

One could also have a time that's "seconds that have elapsed since a TAI epoch", where the TAI epoch is "10 seconds before the Epoch". That's the "count of seconds, *including* leap seconds, since the Epoch" time value, plus 10. [corrected: at 1970-01-01 00:00:00 UTC, TAI was *10* seconds ahead of UTC]

The *ideal* here would be if:

1. When OS time stamping is selected, either POSIX time (with weirdness of some flavor around leap seconds) or UTC time (with seconds counted without regard to leap seconds) could be provided.

2. When hardware-clock time stamping is selected, the time stamps that the OS packet capture mechanism delivers (for example, `PF_PACKET` socket time stamps on Linux) were represented as counts since the POSIX epoch, not some rondo's idea of a TAI epoch, possibly with a choice of "don't count leap seconds" or "count leap seconds";

3. pcapng Interface Description Blocks had an option to indicate whether time stamps for the interface count leap seconds or not.

If the OS can't be made to do that, libpcap could work around it if:

1. it (libpcap) could somehow determine how hardware time stamps are represented - both what epoch they use and whether leap seconds are counted or not - and *adjust* based on the epoch value and report to the caller, in some fashion, whether leap seconds are counted or not;

2. it (libpcap) could determine whether "software" time stamps count leap seconds or not, and report *that* to the caller in the same fashion.

Unfortunately, the libpcap API currently can't report to the caller whether leap seconds are counted.

The best we can do for now is *probably* to have clock values for hardware time stamps that count leap seconds be adjusted, as appropriate, so that *current* time stamps show something close to current time values that don't count them. Doing that would require knowing what sort of time stamps are provided by the hardware and the OS's driver.

**Comment by infrastation** [comment]
If Tx timestamps are taken using one time standard by software near the top of the network stack and Rx timestamps are taken using another time standard by hardware near the bottom of the network stack, the job of converging these timestamps reliably would be difficult and would depend on several factors outside of libpcap.

One potential way to get out of this problem space would be to capture both Rx and Tx packets on the wire, for example, by using a managed switch between the host and the rest of the network. If the switch mirrors the host's port and another host (or even the same host on a different interface) captures the mirrored traffic, then both the original-Rx and the original-Tx packets will be time stamped using the same time standard at the same level of the network stack because on the monitoring port both directions will be Rx. Also in this case the packet capture will show what the original host has actually transmitted (or not) and actually received (or not), not a product of any offloading logic.

**Comment by guyharris** [comment]
> One potential way to get out of this problem space would be to capture both Rx and Tx packets on the wire, for example, by using a managed switch between the host and the rest of the network. If the switch mirrors the host's port and another host (or even the same host on a different interface) captures the mirrored traffic, then both the original-Rx and the original-Tx packets will be time stamped using the same time standard at the same level of the network stack because on the monitoring port both directions will be Rx.

If the reason for using hardware timestamping is to get time stamps that reflect times at which packets are seen on the physical network or are put on the physical network, without any inaccuracies due to delays in processing packets in a networking stack, you'd want the managed switch to timestamp the packets and put the timestamp into a trailer, so that either libpcap or the capturing program can extract and use it.

**Comment by guyharris** [comment]
The ''ideal'' hardware timestamping would have, for transmitted packets, the adapter use its clock to indicate when the first/last bit of the packet hits the wire/air, if, for received packets, it indicates when the first/last bit of the packet is seen on the wire/air, and deliver a "this has been transmitted" indication, causing the driver to hand the packet to taps with the time stamp provided by the adapter (or do the packets in batches with polling or something similar).

I don't know whether any networking hardware does anything like that.

**Comment by infrastation** [comment]
A middle ground could be to use a dedicated packet capture card (possibly in the same host) with two ports configured to repeat, in hardware, each other's packets, to plug the host's normal network interface into one of the repeater ports and the rest of the network -- into the other repeater port.  Then capturing on the capture card would deliver both Tx and Rx packets within the same frame of reference (on the wire, the same time standard) without using a switch.  Whether the hardware timestamp would refer to the beginning or the end of a packet would be vendor-specific.

**Comment by brunomatic** [comment]
> Unfortunately, the libpcap API currently can't report to the caller whether leap seconds are counted.

Agreed, maybe some middle ground could be passing on to the pcap callback something like tpacket{,2,3}_hdr structure tp_status field which indicates if the timestamp came from hardware or software/os for that particular packet. This would shift the responsibility of handling the timestamp handling from libpcap to the application, but would still provide an indication that the timestamps came from two different sources which should be enough for the application to handle the shifting correctly. 
I'm unsure if a similar field/mechanism exist on platforms other than linux kernel.

**Comment by matijaGP** [comment]
Thanks both for the recap with regards to time management and suggestions. Our product is such that it cannot fit additional interfaces for this purpose, so unfortunately those solutions which require further hw aren't suitable. We were thinking of having two capture threads, one for ingress, other egress - if we could differentiate direction of the frames, we'd be able to apply shift on tx or rx, but again we are running tight system and having two threads for this matter would be problematic performance wise.

Would you be opened for adapting PCAP_TSTAMP_ADAPTER for this matter? PCAP_TSTAMP_ADAPTER goes down to SOF_TIMESTAMPING_SYS_HARDWARE which is defunct since 2014 (https://github.com/torvalds/linux/commit/4d276eb6a478307a28ae843836c455bf04b37a3c). From what I can tell, linux was the sole user of the PCAP_TSTAMP_ADAPTER, and at the moment it is unused i.e. deprecated. User could specify how "sync relation" would be established, what would suit us would be struct timeval which would be applied to the frames. In that case, based on the tp_status from tpacket_v3 (TP_STATUS_TS_SOFTWARE/TP_STATUS_TS_HARDWARE) correction would be applied which would "sync" timestamp. Sync is interesting here, I see it possible only for shifting the values.

I understand this is to some extent reinventing SOF_TIMESTAMPING_SYS_HARDWARE, in the end, it looks like the only user of that was (https://github.com/torvalds/linux/commit/c6d5fefaa35eda3dcab5c78a16def6ed555b685c) however this use case I see as a  valid one - NICs usually manage time in TAI, and TX has no way of getting that ts (other to clock_gettime with the ptp device, but that might easily end up performance issue even with clock_gettime being vdso).

**Comment by guyharris** [comment]
> Agreed, maybe some middle ground could be passing on to the pcap callback something like tpacket{,2,3}_hdr structure tp_status field which indicates if the timestamp came from hardware or software/os for that particular packet.

Changing the API for the pcap callback might break source compatibility and *would* break binary compatibility, so that's not going to happen.

**Comment by infrastation** [comment]
As far as I understand, you will need to know the difference between the host clock and TAI (which, generally speaking, is not strictly a constant) in any case.

If you capture using [DLT_LINUX_SLL](https://www.tcpdump.org/linktypes/LINKTYPE_LINUX_SLL.html) or [DLT_LINUX_SLL2](https://www.tcpdump.org/linktypes/LINKTYPE_LINUX_SLL2.html), the direction of each packet will be visible in the packet type, and in this setup the time standard of each packet is a 1:1 mapping of the direction. Using the difference, you could converge the two time standards on a per-packet basis just after the capture or even offline. Does it make sense?

**Comment by guyharris** [comment]
> Would you be opened for adapting PCAP_TSTAMP_ADAPTER for this matter? PCAP_TSTAMP_ADAPTER goes down to SOF_TIMESTAMPING_SYS_HARDWARE which is defunct since 2014 (https://github.com/torvalds/linux/commit/4d276eb6a478307a28ae843836c455bf04b37a3c). From what I can tell, linux was the sole user of the PCAP_TSTAMP_ADAPTER

It's *currently* the sole user. It was *created* in order to be used by *all* systems that support it, and that's *still* what it's intended to do. What the pcap-tstamp(7) man page says about it is:

            PCAP_TSTAMP_ADAPTER - adapter
                 Time stamp provided by the network adapter on which the
                 capture is being done.  This is a high-precision time stamp,
                 synchronized with the host operating system's clock.

            PCAP_TSTAMP_ADAPTER_UNSYNCED - adapter_unsynced
                 Time stamp provided by the network adapter on which the
                 capture is being done.  This is a high-precision time stamp;
                 it is not synchronized with the host operating system's
                 clock.

> and at the moment it is unused i.e. deprecated.

Presumably by "it" you mean `SOF_TIMESTAMPING_SYS_HARDWARE`. `PCAP_TSTAMP_ADAPTER` isn't deprecated; we haven't documented it as such or marked it as such.

> User could specify how "sync relation" would be established, what would suit us would be struct timeval which would be applied to the frames.

"synchronized" means that the adapter's timer is adjusted to match the host OS's clock, although perhaps we should specify that it matches *a* host OS clock, as a host might support both "leap-secondless time", which does Weird Stuff around leap seconds, and "normal time", which counts leap seconds the way it counts all other seconds. (I think newer versions of Windows might support both.)

"not synchronized" means "runs independently of the host OS's clock".

We might want to add a *separate* flag to indicate how we want the clock to handle leap seconds.

The epoch of the clock should *always* be the POSIX epoch, *regardless* of how the clock handles leap seconds, and it is either the reponsibility of the OS or of libpcap to ensure that, for any given interface, received and transmitted packet timestamps treat leap seconds the same way.

It should not be the responsibility of the application to do anything other than specify whether it wants "leap-secondless time" or "normal time"; in particular, it should *not* be the responsibility of the application to specify any offset.

**Comment by guyharris** [comment]
> As far as I understand, you will need to know the difference between the host clock and TAI (which, generally speaking, is not strictly a constant) in any case.

Or, rather, to know whether the host clock pay attention to leap seconds normally or ignores them. ***Both TAI and UTC take leap seconds into account***;  the difference is that TAI goes from 23:59:59 to 00:00:00 the next day for all days, while UTC goes from 23:59:59 to 23:59:60 on the last day of a month that has a leap second, and then goes from 23:59:60 to 00:00:00 at the end of the leap second. POSIX time does *neither* of those; it is *not* UTC.

**Comment by matijaGP** [comment]
> If you capture using [DLT_LINUX_SLL](https://www.tcpdump.org/linktypes/LINKTYPE_LINUX_SLL.html) or [DLT_LINUX_SLL2](https://www.tcpdump.org/linktypes/LINKTYPE_LINUX_SLL2.html), the direction of each packet will be visible in the packet type, and in this setup the time standard of each packet is a 1:1 mapping of the direction. Using the difference, you could converge the two time standards on a per-packet basis just after the capture or even offline. Does it make sense?

This just might work, thanks, I'm bit worried only about the performance overhead, but that can be measured.

**Comment by matijaGP** [comment]
> It should not be the responsibility of the application to do anything other than specify whether it wants "leap-secondless time" or "normal time"; in particular, it should _not_ be the responsibility of the application to specify any offset.

That's ok, that info can be obtained from tzdata, application wouldn't have to provide it.

**Comment by guyharris** [comment]
> That's ok, that info can be obtained from tzdata, application wouldn't have to provide it.

*If* your OS uses tzdata and tzdata files with leap second information are available. About the only UN\*X I know of that *doesn't* use tzdata is HP-UX, and that's no longer supported by HP and probably doesn't support hardware timestamping in any case. If Linux distributions provide both "posix" and "right" files, the leap second information should be available to libpcap, although not necessarily from the system libraries that use tzdata. (I should add some APIs to the sample tzdata implementation to get information such as leap second dates and UTC offset change dates and times, in the hopes that they'll catch on.)

**Comment by matijaGP** [comment]
We are quite flexible with our Linux based distribution on what needs to be added to our system, so we'll be fine with that.

Do I understand correctly that you'd consider supporting this scenario of ours where libpcap would be configured to use leapless time? For our scenario that would mean "use leapless time when timestamp is SW, use HW timestamp as it is".

**Comment by guyharris** [comment]
> Do I understand correctly that you'd consider supporting this scenario of ours where libpcap would be configured to use leapless time?

My idea is to have libpcap support having applications choose whether to get timestamps that don't count leap seconds, or get timestamps that do count leap seconds, with incoming and outgoing packets having the same timestamp type. This wouldn't involve configuring libpcap at *compile* time.

When you refer to "leapless" time, do you mean timestamps that *don't* count leap seconds (which is what you get for software timestamps on most if not all UN\*X systems, as that's what POSIX specifies) or timestamps that *do* count leap seconds.

Note that *neither* of them are "TAI" or "UTC". Any seconds-since-some-epoch time stamp that counts leap seconds can be converted *either* to TAI or UTC in a year/month/day/hour/minute/second(+fraction). For times in 1972 and later:

- to convert to TAI, take the time stamp, adjust it if necessary to use [an epoch that's 8 seconds *before* the POSIX epoch (1969-12-31 23:59:50 UTC, which is 1970-01-01 00:00:00 UTC)](https://github.com/chmike/posix_tai_time_converter/issues/3) and do a POSIX-style conversion that treats every day as being exactly 86400 seconds long;
- to convert to UTC, take the time stamp, adjust it if necessary to use the POSIX epoch, and do the conversion that the tzdb sample code would do for UTC *with the "right" tzdata files*.

(For times before 1972, it's more complicated, because either 1) neither TAI nor UTC existed at the time, 2) TAI existed but UTC didn't, or 3) they both existed but UTC was not adjusted leap seconds, but by mechanisms such as tweaking its frequency. The tzdb sample code does *not* make any attempt to deal with that.)

A seconds-since-some-epoch time stamp that doesn't count time stamps cannot always be converted to TAI *or* UTC without a table of leap seconds. For example, there is no valid POSIX time stamp value corresponding to 2016-12-31 23:59:60 UTC (yes, that really *is* the date and UTC time of the last second of 2016!).

**Comment by matijaGP** [comment]
> My idea is to have libpcap support having applications choose whether to get timestamps that don't count leap seconds, or get timestamps that do count leap seconds, with incoming and outgoing packets having the same timestamp type. This wouldn't involve configuring libpcap at _compile_ time.

I'm not sure that'd help our use case. Our original problem is TX and RX having unsynced timestamps when using "adapter_unsynced" and whether we could expand libpcap to have those synced. Typically, TX will be in UTC and RX in TAI as that's how typically setups which sync themselves with PTP look like.
 
> When you refer to "leapless" time, do you mean timestamps that _don't_ count leap seconds (which is what you get for software timestamps on most if not all UN*X systems, as that's what POSIX specifies) or timestamps that _do_ count leap seconds.

I was referring to TAI.

**Comment by guyharris** [comment]
> Our original problem is TX and RX having unsynced timestamps when using "adapter_unsynced" and whether we could expand libpcap to have those synced. 

"Unsynced" means "the host and adapter don't check their times with each other and keep them in sync".

What's happening here is different - the host and adapter aren't even keeping the same *type* of time.

> Typically, TX will be in UTC and RX in TAI

More correctly, the transmit times come from the OS, which supplies POSIX time, which is neither TAI nor UTC. Both TAI and UTC advance during positive leap seconds; they just advance in different ways; if there is a leap second at the end of a day, TAI advances the clock from 23:59:59 to 00:00:00 the next day, i.e. it just counts seconds without treating some seconds differently, while UTC advances the clock from 23:59:59 to 23:59:60, remaining in the same day (making that day have 86401 seconds) and, in the second *after* the leap second, advances the clock from 23:59:60 to 00:00:00 the next day.

POSIX time is different - it *ignores* leap seconds.  As [section A.4.19 "Seconds Since the Epoch](https://pubs.opengroup.org/onlinepubs/9799919799/xrat/V4_xbd_chap01.html#tag_21_04_19) of the current POSIX specification says:

> Coordinated Universal Time (UTC) includes leap seconds. However, in POSIX time (seconds since the Epoch), leap seconds are ignored (not applied) to provide an easy and compatible method of computing time differences. Broken-down POSIX time is therefore not necessarily UTC, despite its appearance.
> 
> As of December 2007, 23 leap seconds had been added to UTC since the Epoch, 1 January, 1970. Historically, one leap second is added every 15 months on average, so this offset can be expected to grow with time.
> 
> Most systems' notion of "time" is that of a continuously increasing value, so this value should increase even during leap seconds. However, not only do most systems not keep track of leap seconds, but most systems are probably not synchronized to any standard time reference. Therefore, it is inappropriate to require that a time represented as seconds since the Epoch precisely represent the number of seconds between the referenced time and the Epoch.
> 
> It is sufficient to require that applications be allowed to treat this time as if it represented the number of seconds between the referenced time and the Epoch. It is the responsibility of the vendor of the system, and the administrator of the system, to ensure that this value represents the number of seconds between the referenced time and the Epoch as closely as necessary for the application being run on that system.
> 
> It is important that the interpretation of time names and seconds since the Epoch values be consistent across conforming systems; that is, it is important that all conforming systems interpret "536457599 seconds since the Epoch" as 59 seconds, 59 minutes, 23 hours 31 December 1986, regardless of the accuracy of the system's idea of the current time. The expression is given to ensure a consistent interpretation, not to attempt to specify the calendar. The relationship between *tm_yday* and the day of week, day of month, and month is in accordance with the Gregorian calendar, and so is not specified in POSIX.1.
> 
> Consistent interpretation of seconds since the Epoch can be critical to certain types of distributed applications that rely on such timestamps to synchronize events. The accrual of leap seconds in a time standard is not predictable. The number of leap seconds since the Epoch will likely increase. POSIX.1 is more concerned about the synchronization of time between applications of astronomically short duration.

...

> The topic of whether seconds since the Epoch should account for leap seconds has been debated on a number of occasions, and each time consensus was reached (with acknowledged dissent each time) that the majority of users are best served by treating all days identically. (That is, the majority of applications were judged to assume a single length—as measured in seconds since the Epoch—for all days. Thus, leap seconds are not applied to seconds since the Epoch.) Those applications which do care about leap seconds can determine how to handle them in whatever way those applications feel is best. This was particularly emphasized because there was disagreement about what the best way of handling leap seconds might be. It is a practical impossibility to mandate that a conforming implementation must have a fixed relationship to any particular official clock (consider isolated systems, or systems performing "reruns" by setting the clock to some arbitrary time).
> 
> Note that as a practical consequence of this, the length of a second as measured by some external standard is not specified. This unspecified second is nominally equal to an International System (SI) second in duration. Applications must be matched to a system that provides the particular handling of external time in the way required by the application.

...

> Austin Group Defect 1627 is applied, clarifying that the relationship between the actual date and time in Coordinated Universal Time, as determined by the International Earth Rotation Service, and the system's current value for seconds since the Epoch is unspecified.

So you are *NOT* getting UTC time stamps for transmitted packets, you're getting POSIX time stamps for transmitted packets, i.e. you're getting a count of *non-leap* seconds since the POSIX epoch.

For *received* packets, you are probably getting time stamps that are seconds - *including leap seconds* - from some epoch. If that epoch happens to be the POSIX epoch, it can be converted to UTC by `gmtime()` and to local time by `localtime()` if the "right" tzdata files are used rather than the "posix" tzdata files. If the epoch is 1970-01-01 00:00:00 *TAI*, then, if the "posix" tzdata files are used, the result you get from `gmtime()` will be TAI.

If your goal is to have libpcap provide the same type of timestamp for received and transmitted packets, the first thing you need to do is decide which type of timestamp you want for both received and transmitted packets:

- a timestamp that counts all seconds, including leap seconds, and that, when processed by `gmtime()` when the "right" files are used, gives UTC;
- a timestamp that counts all seconds, including leap seconds, and that, when processed by `gmtime()` when the "posix" files are used, gives TAI;
- a timestamp that *doesn't* count all seconds, just non-leap seconds, and that, when processed by `gmtime()`, gives UTC *except when the time stamp is on a leap second*.

**Comment by matijaGP** [comment]
> If your goal is to have libpcap provide the same type of timestamp for received and transmitted packets, the first thing you need to do is decide which type of timestamp you want for both received and transmitted packets:
> 
> * a timestamp that counts all seconds, including leap seconds, and that, when processed by `gmtime()` when the "right" files are used, gives UTC;
> * a timestamp that counts all seconds, including leap seconds, and that, when processed by `gmtime()` when the "posix" files are used, gives TAI;
> * a timestamp that _doesn't_ count all seconds, just non-leap seconds, and that, when processed by `gmtime()`, gives UTC _except when the time stamp is on a leap second_.

What I'd like is to have TX ts to be in sync with RX, either with assumption NIC's clock ticks in TAI, or no assumption at all, leave user to configure relation, where relation can be be only difference in time, not other clock parameters such as e.g. frequency.

I believe you understand my problem very well, what would be your suggestion? Please take into account RX and TX are not of the same type, in RX we want to use form of adapter clock, while for TX that is not possible, so starting point is they are different.

**Comment by guyharris** [comment]
> What I'd like is to have TX ts to be in sync with RX, either with assumption NIC's clock ticks in TAI,

What does it mean for a clock to "tick in TAI"? In order to tick in TAI - or in UTC - the clock would have to tick in the form of a date, hour, minute, and second; a clock that just counts seconds doesn't tick in TAI or UTC.

And does "in sync" mean "adjust the time stamps for received packets to match the same sort of time that's used for transmitted packets" or 'adjust the time stamps for transmitted packets to match the same sort of time that's used for received packets"?

From the time stamps shown:

```
10:49:58.163774 IP 192.168.101.156 > 192.168.101.45: ICMP echo request, id 1, seq 1700, length 64
10:49:21.163846 IP 192.168.101.45 > 192.168.101.156: ICMP echo reply, id 1, seq 1700, length 64
```

the echo reply time stamps appear to be 37 seconds behind the echo request time stamps. This would suggest that the time stamps for the requests include leap seconds (i.e., are coming from a clock not being coerced by POSIX into ignoring leap seconds) and the time stamps for the replies do not include leap seconds (i.e., are coming from a clock being coerced by POSIX into pretending that time doesn't lapse during leap seconds). That suggests that the machine to which the echo requests are being sent is the one whose adapter is being used for the capture.

If leap seconds were no longer being added (or subtracted, although no negative leap seconds have ever occurred), libpcap could either:

- add 37 seconds to transmit time stamps, giving a time stamp that won't match wall clock time if you use `gmtime()` or `localtime()` and print it out (as tcpdump and Wireshark do);
- subtract 37 seconds from receive time stamps, giving a time stamp that *will* match  wall clock time if you use `gmtime()` or `localtime()` and print it out (i.e., a POSIX time stamp).

Unfortunately, we can't *guarantee* that leap seconds will no longer be added. However, they haven't been added in almost 10 years, so *maybe* our luck will hold.

**Comment by matijaGP** [comment]
> What does it mean for a clock to "tick in TAI"? In order to tick in TAI - or in UTC - the clock would have to tick in the form of a date, hour, minute, and second; a clock that just counts seconds doesn't tick in TAI or UTC.

In the end it is timer register whose contents are further controlled and interpreted by OS and time management software running on the device (Linux, PTP). I can understand you want precise definition, however it is obvious you are way deeper in time related topics and I'm sorry for not being able to follow up with that. This timer is ahead for current UTC-TAI offset and that is what NIC stamps incoming frames with.
 
> And does "in sync" mean "adjust the time stamps for received packets to match the same sort of time that's used for transmitted packets" or 'adjust the time stamps for transmitted packets to match the same sort of time that's used for received packets"?

Both would be fine.

> From the time stamps shown:
> 
> ```
> 10:49:58.163774 IP 192.168.101.156 > 192.168.101.45: ICMP echo request, id 1, seq 1700, length 64
> 10:49:21.163846 IP 192.168.101.45 > 192.168.101.156: ICMP echo reply, id 1, seq 1700, length 64
> ```
> 
> the echo reply time stamps appear to be 37 seconds behind the echo request time stamps. This would suggest that the time stamps for the requests include leap seconds (i.e., are coming from a clock not being coerced by POSIX into ignoring leap seconds) and the time stamps for the replies do not include leap seconds (i.e., are coming from a clock being coerced by POSIX into pretending that time doesn't lapse during leap seconds). That suggests that the machine to which the echo requests are being sent is the one whose adapter is being used for the capture.

Yes.

> If leap seconds were no longer being added (or subtracted, although no negative leap seconds have ever occurred), libpcap could either:
> 
> * add 37 seconds to transmit time stamps, giving a time stamp that won't match wall clock time if you use `gmtime()` or `localtime()` and print it out (as tcpdump and Wireshark do);
> * subtract 37 seconds from receive time stamps, giving a time stamp that _will_ match  wall clock time if you use `gmtime()` or `localtime()` and print it out (i.e., a POSIX time stamp).
> 
> Unfortunately, we can't _guarantee_ that leap seconds will no longer be added. However, they haven't been added in almost 10 years, so _maybe_ our luck will hold.

If you'd be okay with sorting out this topic i.e. syncing either way, diff to be applied can be supplied in any way you see fitting.

**Comment by infrastation** [comment]
Another potential way to avoid this problem space would be using an external active Ethernet tap box between the host and the rest of the network. This way the host would need one or two additional regular Ethernet ports to take mirrored packets from the tap, but all packets would be timestamped using the same time, whether standard or not.

**Comment by matijaGP** [comment]
> Another potential way to avoid this problem space would be using an external active Ethernet tap box between the host and the rest of the network. This way the host would need one or two additional regular Ethernet ports to take mirrored packets from the tap, but all packets would be timestamped using the same time, whether standard or not.

Your previous idea (using DLT_LINUX_SLL or DLT_LINUX_SLL2) would fit as well (deploying additional HW or using additional ports is not possible for our product). Reason why I'm still asking about thinking to solve it differently is because I think this use case is a valid one, NIC timestamping with TAI, and host with something else is imo legitimate use case which would be nice from libpcap to support.
