### ISSUE TITLE
tcpdump filter bug

### ISSUE THREAD

**Issue by amorsen** [the-tcpdump-group/libpcap#945]
tcpdump version 4.9.3
libpcap version 1.9.1 (with TPACKET_V3)
OpenSSL 1.1.1g FIPS  21 Apr 2020

This is a very simplified example where I believe tcpdump filters incorrectly. I would attach a pcap file demonstrating the problem, but that is apparently not possible here.

To create the pcap file do:

Pick any address that answers ping requests, and just replace 192.168.1.1 in the following.

tcpdump -w bug-icmp.pcap host 192.168.1.1 and icmp
ping 192.168.1.1

With the resulting file do:

tcpdump -nr bug-icmp.pcap 'host 192.168.1.1 and not ((host 1.2.3.4 or host 5.6.7.8) and icmp) and not (host 5.6.7.8 or host 192.168.1.1)' 
reading from file bug-icmp.pcap, link-type EN10MB (Ethernet)
10:37:23.323954 IP 192.168.1.1 > 192.168.1.51: ICMP echo reply, id 6, seq 1, length 64
10:37:24.340916 IP 192.168.1.1 > 192.168.1.51: ICMP echo reply, id 6, seq 2, length 64
10:37:25.364920 IP 192.168.1.1 > 192.168.1.51: ICMP echo reply, id 6, seq 3, length 64
10:37:26.366324 IP 192.168.1.1 > 192.168.1.51: ICMP echo reply, id 6, seq 4, length 64

I believe the output from this filter should be empty, since the packet cannot both be from host 192.168.1.1 and at the same time NOT from host 192.168.1.1.

If I change the first 5.6.7.8 to 6.7.8.9 I get:

tcpdump -nr bug-icmp.pcap 'host 192.168.1.1 and not ((host 1.2.3.4 or host 6.7.8.9) and icmp) and not (host 5.6.7.8 or host 192.168.1.1)' 
reading from file bug-icmp.pcap, link-type EN10MB (Ethernet)

which is the output I expected.

It is not immediately obvious why changing an unrelated IP address affects filtering on 192.168.1.1.

**Comment by guyharris** [comment]
The "expression rejects all packets" test is done only if the optimizer is on; detecting filters that never match involves analysis that's done in the optimizer.

However, even *with* the optimizer on, it didn't reduce the filter to "ret 0".  The filter 'host 192.168.1.1 and not (host 5.6.7.8 or host 192.168.1.1)', with the "and not" clause in the middle removed, *is* recognized as matching nothing, but the middle clause somehow confuses the optimizer.

**Comment by tenarchits** [comment]
This test case creates many blocks which are rearranged by `or_pullup` in `opt_blks` .  I think running `find_dom` every time the pullup is successful fixes this issue as it allows the dominator sets to be recomputed based on the updated control flow graph.

**Comment by guyharris** [comment]
> This test case creates many blocks which are rearranged by or_pullup in opt_blks . I think running find_dom every time the pullup is successful fixes this issue as it allows the dominator sets to be recomputed based on the updated control flow graph.

Merging #976 does appear to fix this, in that the filter no longer matches any packets.

It doesn't report "expression rejects all packets"; the BPF program produced is

```
(000) ldh      [12]
(001) jeq      #0x800           jt 2	jf 22
(002) ld       [26]
(003) jeq      #0xc0a80101      jt 4	jf 7
(004) ld       [30]
(005) jeq      #0x1020304       jt 12	jf 6
(006) jeq      #0x5060708       jt 12	jf 18
(007) ld       [30]
(008) jeq      #0xc0a80101      jt 9	jf 22
(009) ld       [26]
(010) jeq      #0x1020304       jt 12	jf 11
(011) jeq      #0x5060708       jt 12	jf 22
(012) ldb      [23]
(013) jeq      #0x1             jt 22	jf 14
(014) ld       [26]
(015) jeq      #0x5060708       jt 22	jf 16
(016) ld       [30]
(017) jeq      #0x5060708       jt 22	jf 18
(018) jeq      #0xc0a80101      jt 22	jf 19
(019) ld       [26]
(020) jeq      #0xc0a80101      jt 22	jf 21
(021) ret      #262144
(022) ret      #0
```

**Comment by infrastation** [comment]
As far as I could make sense of this problem, its remaining part can be reproduced as follows:
```
A='host 192.168.1.1'
B='(host 1.2.3.4 and icmp)'

# expected
$ filtertest IPV4 "$A and not $A"
filtertest: expression rejects all packets

# expected
$ filtertest IPV4 "not $A and $A"
filtertest: expression rejects all packets

# unexpected
$ filtertest IPV4 "$B and not $B"
(000) ld       [12]
(001) jeq      #0x1020304       jt 4	jf 2
(002) ld       [16]
(003) jeq      #0x1020304       jt 4	jf 11
(004) ldb      [9]
(005) jeq      #0x1             jt 6	jf 11
(006) ld       [12]
(007) jeq      #0x1020304       jt 11	jf 8
(008) ld       [16]
(009) jeq      #0x1020304       jt 11	jf 10
(010) ret      #262144
(011) ret      #0

# expected
$ filtertest IPV4 "not $B and $B"
filtertest: expression rejects all packets

# expected
$ filtertest IPV4 "$A and not $A and $B"
filtertest: expression rejects all packets

# expected
$ filtertest IPV4 "$A and not $A and not $B"
filtertest: expression rejects all packets

# unexpected
$ filtertest IPV4 "$A and $B and not $A"
(000) ld       [12]
(001) jeq      #0xc0a80101      jt 4	jf 2
(002) ld       [16]
(003) jeq      #0xc0a80101      jt 4	jf 15
(004) ld       [12]
(005) jeq      #0x1020304       jt 8	jf 6
(006) ld       [16]
(007) jeq      #0x1020304       jt 8	jf 15
(008) ldb      [9]
(009) jeq      #0x1             jt 10	jf 15
(010) ld       [12]
(011) jeq      #0xc0a80101      jt 15	jf 12
(012) ld       [16]
(013) jeq      #0xc0a80101      jt 15	jf 14
(014) ret      #262144
(015) ret      #0

# unexpected
$ filtertest IPV4 "$A and not $B and not $A"
(000) ld       [12]
(001) jeq      #0xc0a80101      jt 4	jf 2
(002) ld       [16]
(003) jeq      #0xc0a80101      jt 4	jf 15
(004) ld       [12]
(005) jeq      #0x1020304       jt 8	jf 6
(006) ld       [16]
(007) jeq      #0x1020304       jt 8	jf 10
(008) ldb      [9]
(009) jeq      #0x1             jt 15	jf 10
(010) ld       [12]
(011) jeq      #0xc0a80101      jt 15	jf 12
(012) ld       [16]
(013) jeq      #0xc0a80101      jt 15	jf 14
(014) ret      #262144
(015) ret      #0
```
