### ISSUE TITLE
[Patch] rpcap:// support

### ISSUE THREAD

**Issue by guyharris** [the-tcpdump-group/libpcap#266]
Converted from [SourceForge issue 3518553](http://sourceforge.net/support/tracker.php?aid=3518553), submitted by darkjames

Attaching patch to support remote pcap (rcpcap:// URLs)
There's no rpcap specification, so it's written from winpcap sources + wireshark rpcap dissector.
Still it's much more compact than winpcap version
(but we miss some API for auto-detecting interfaces, and so on... I'll submit missing API in next patch)

It mostly work, but... something is wrong with filtering. It sometimes work, sometimes don't.
(I was testing it with rpcapd on Windows machine)

Cheers,
 Kuba.

**Comment by Whoopie** [comment]
May I ask about the status? The feature is still interesting for me.

**Comment by guyharris** [comment]
Still a work in progress.

I'll probably end up using WinPcap's code, instead, as it's a more complete implementation (supports both Windows and UN\*X, handles some cases the reimplementation doesn't seem to), but I need to add a new API for enumerating interfaces, so both opening a device and enumerating interfaces can deal with a variety of ways of authenticating.

**Comment by jcreigh** [comment]
Would it be possible to get a new patch with at least the partial support?

**Comment by guyharris** [comment]
> I'll probably end up using WinPcap's code

That's currently checked in, albeit...

> but I need to add a new API for enumerating interfaces, so both opening a device and enumerating interfaces can deal with a variety of ways of authenticating.

...without the new API, currently.  That part's a work in progress.

You have to configure libpcap with `--enable-remote`, but it seems to work with the tests I've done (macOS client, macOS and Solaris rpcapd built from the current source, Windows rpcapd as distributed in WinPcap; tcpdump, with some additional changes, and Wireshark as clients).

I'll leave it open until I finish all the API work (and code auditing...).

**Comment by jmayer** [comment]
Would it make sense to fully move the code from pcap-new.c into pcap-rpcap.c? pcap-new.c doesn't seem to have any value outside pcap-rpcap.c.

**Comment by guyharris** [comment]
> Would it make sense to fully move the code from pcap-new.c into pcap-rpcap.c? pcap-new.c doesn't seem to have any value outside pcap-rpcap.c.

My ultimate goal is to have the APIs implemented in `pcap-new.c` exist *only* for backwards compatibility with WinPcap, and to have `pcap_create()`/`pcap_activate()` be the official way to do remote capture, with a new API for listing remote (and local) interfaces.

The `pcap-new.c` APIs - and the new active-mode APIs in `pcap-rpcap.c` - would be useful on UN\*X, in that case, only to support 1) porting code from Windows to UN\*X and 2) supporting with Windows applications using those APIs under [Wine](https://www.winehq.org).

However, as the APIs in `pcap-new.c` could be used by Windows applications to access *local* interfaces and savefiles, I'd prefer to keep them separate from the private-to-RPCAP code and the RPCAP-only APIs in `pcap-rpcap.c`.

**Comment by jmayer** [comment]
So once you ulimately succeed it could be moved into pcap-win32.c? Another thing that I don't like about the file is its name - maybe pcap-win32-aux.c would be a better one before removing it entirely.

**Comment by guyharris** [comment]
> So once you ulimately succeed it could be moved into pcap-win32.c?

No, because `pcap-win32.c` isn't "pcap extensions for Windows", it's "the pcap capture module, for local capture, that runs atop the WinPcap and NPcap driver and `Packet.dll`", just as `pcap-bpf.c` is "the pcap capture module, for local capture, that runs atop BPF" and `pcap-linux.c` is "the pcap capture module, for local capture, that runs atop Linux `PF_PACKET` sockets" and....  `pcap-win32.c` is a misleading name; if somebody came up with a completely different driver+library with a different interface, or if Windows 10 Happy 2018 Edition included a built-in capture API that was at least as capable as what WinPcap/NPcap provide, there could be a module for that, which would also work with WIn32 (and Win64).

Perhaps renaming `pcap-new.c` to `pcap-wpcap-compat.c` or something such as that, once none of the routines in it are *required* for remote capture support.

**Comment by sunny137** [comment]
This is a very old ticket! I am trying to compile libpcap with remote capture support but running into this issue, clearly missing something fundamental.

Is this feature supported in latest in latest stable release? I am using 1.8.1

libpcap-1.8.1$ ./configure --enable-remote 
configure: WARNING: unrecognized options: --enable-remote

checking build system type... x86_64-unknown-linux-gnu
checking host system type... x86_64-unknown-linux-gnu
checking target system type... x86_64-unknown-linux-gnu
checking for gcc... gcc
checking whether the C compiler works... yes
checking for C compiler default output file name... a.out

---

**Comment by guyharris** [comment]
> Is this feature supported in latest in latest stable release? 

No.  It's only in the master branch of the Git repository.

**Comment by gabdu** [comment]
I am using libpcap master branch as mentioned (which is supposed to have rpcapd support) compiled in. I have compiled tcpdump with master libpcap version and using rpcapd out of the same tree/version.

I see that tcpdump and rpcapd exchange some info over sockets but rpcapd complains as follows?:

$sudo ./rpcapd -4 -n -v -a "127.0.0.1,2003"
Press CTRL + C to stop the server...
Connecting to host 127.0.0.1, port 2003, using protocol IPv4
I'm currently discarding data

**The other endpoint sent a message that is not allowed here.**
I'm currently discarding data

The other endpoint sent a message that is not allowed here.

What seems to be going wrong here? Any inputs will be highly appreciated. 


Here is what tcpdump says:

18:22:32.657450 IP 172.17.0.2.2003 > 172.17.0.1.35600: Flags [P.], seq 1941715525:1941715533, ack 3132080727, win 311, options [nop,nop,TS val 738336720 ecr 738329452], length 8
        0x0000:  4500 003c 397d 4000 4006 a919 ac11 0002  E..<9}@.@.......
        0x0010:  ac11 0001 07d3 8b10 73bc 3a45 baaf c257  ........s.:E...W
        0x0020:  8018 0137 5854 0000 0101 080a 2c02 1fd0  ...7XT......,...
        0x0030:  2c02 036c 000d 0000 0000 0000            ,..l........
18:22:32.657751 IP 172.17.0.1.35600 > 172.17.0.2.2003: Flags [P.], seq 3132080727:3132080825, ack 1941715533, win 229, options [nop,nop,TS val 738336720 ecr 738336720], length 98
        0x0000:  4500 0096 af15 4000 4006 3327 ac11 0001  E.....@.@.3'....
        0x0010:  ac11 0002 8b10 07d3 baaf c257 73bc 3a4d  ...........Ws.:M
        0x0020:  8018 00e5 58ae 0000 0101 080a 2c02 1fd0  ....X.......,...
        0x0030:  2c02 1fd0 0001 0010 0000 0035 5468 6520  ,..........5The.
        0x0040:  5250 4341 5020 6461 656d 6f6e 2072 6563  RPCAP.daemon.rec
        0x0050:  6569 7665 6420 6120 6d65 7373 6167 6520  eived.a.message.
        0x0060:  7468 6174 2069 7320 6e6f 7420 7661 6c69  that.is.not.vali
        0x0070:  6400 0100 1100 0000 1d52 5043 4150 2076  d........RPCAP.v
        0x0080:  6572 7369 6f6e 206e 756d 6265 7220 6d69  ersion.number.mi
        0x0090:  736d 6174 6368                           smatch
18:22:32.703840 IP 172.17.0.2.2003 > 172.17.0.1.35600: Flags [.], ack 3132080825, win 311, options [nop,nop,TS val 738336732 ecr 738336720], length 0
        0x0000:  4500 0034 397e 4000 4006 a920 ac11 0002  E..49~@.@.......
        0x0010:  ac11 0001 07d3 8b10 73bc 3a4d baaf c2b9  ........s.:M....
        0x0020:  8010 0137 584c 0000 0101 080a 2c02 1fdc  ...7XL......,...
        0x0030:  2c02 1fd0

**Comment by guyharris** [comment]
OK, it's in 1.9.x.  Done.
