### ISSUE TITLE
Will libpcap intercept packet for socket client?

### ISSUE THREAD

**Issue by WorstCodeWay** [the-tcpdump-group/libpcap#1250]
Hi, I'm new to socket and libpcap, I have introduced libpcap into my project to scan tcp ports. It can scan ports online states rightly. If a port is online, I(a client) will create a socket client connect to it(a server).
However, I find I cannot connect to that online server. From tcpdump result, the server has sent SYN-ACK packet to client following client's SYN pakcet, but client won't send any ACK to server (as if not seeing that SYN-ACK packet), so I doubt if libpcap intercepts packets and discards them after using it cause the socket client cannot receive that SYN-ACK packet and is disconnected? Or some basic settings should be applied to libpcap?

Belowing result captured by tcpdump and `kolbin.65535` is my source client host ip and port, 172.18.0.4.20002 is target server ip and port. 65535 is libpcap send and receive packet port, and 49236 is socket client port used to connect to server.
```
$ sudo tcpdump -i eno1 'host 172.18.0.4 and port 20002'
tcpdump: verbose output suppressed, use -v or -vv for full protocol decode
listening on eno1, link-type EN10MB (Ethernet), capture size 262144 bytes
09:52:23.631863 IP kolbin.65535 > 172.18.0.4.20002: Flags [S], seq 0, win 32678, length 0
09:52:23.632115 IP 172.18.0.4.20002 > kolbin.65535: Flags [S.], seq 3642905753, ack 1, win 29200, options [mss 1460], length 0
09:52:23.835741 IP kolbin.65535 > 172.18.0.4.20002: Flags [R], seq 0, win 32678, length 0
09:52:24.643092 IP 172.18.0.4.20002 > kolbin.65535: Flags [S.], seq 3642905753, ack 1, win 29200, options [mss 1460], length 0
09:52:24.644326 IP kolbin.49236 > 172.18.0.4.20002: Flags [S], seq 3151084404, win 64240, options [mss 1460,sackOK,TS val 4207200360 ecr 0,nop,wscale 7], length 0
09:52:24.644821 IP 172.18.0.4.20002 > kolbin.49236: Flags [S.], seq 3548270515, ack 3151084405, win 28960, options [mss 1460,sackOK,TS val 1468864032 ecr 4207200360,nop,wscale 7], length 0
09:52:24.644904 IP kolbin.49236 > 172.18.0.4.20002: Flags [.], ack 1, win 502, options [nop,nop,TS val 4207200361 ecr 1468864032], length 0
09:52:24.645409 IP kolbin.49236 > 172.18.0.4.20002: Flags [P.], seq 1:55, ack 1, win 502, options [nop,nop,TS val 4207200362 ecr 1468864032], length 54
09:52:24.645744 IP 172.18.0.4.20002 > kolbin.49236: Flags [.], ack 55, win 227, options [nop,nop,TS val 1468864032 ecr 4207200362], length 0
09:52:24.658614 IP 172.18.0.4.20002 > kolbin.49236: Flags [P.], seq 1:243, ack 55, win 227, options [nop,nop,TS val 1468864035 ecr 4207200362], length 242
09:52:24.658629 IP kolbin.49236 > 172.18.0.4.20002: Flags [.], ack 243, win 501, options [nop,nop,TS val 4207200375 ecr 1468864035], length 0
09:52:24.856078 IP kolbin.65535 > 172.18.0.4.20002: Flags [S], seq 0, win 32678, length 0
09:52:24.856466 IP 172.18.0.4.20002 > kolbin.65535: Flags [S.], seq 3642905753, ack 1, win 29200, options [mss 1460], length 0
09:52:25.880067 IP kolbin.65535 > 172.18.0.4.20002: Flags [S], seq 0, win 32678, length 0
09:52:25.880329 IP 172.18.0.4.20002 > kolbin.65535: Flags [S.], seq 3642905753, ack 1, win 29200, options [mss 1460], length 0
09:52:25.880364 IP kolbin.65535 > 172.18.0.4.20002: Flags [R], seq 1, win 0, length 0
09:52:26.703700 IP kolbin.65535 > 172.18.0.4.20002: Flags [S], seq 0, win 32678, length 0
09:52:26.704156 IP 172.18.0.4.20002 > kolbin.65535: Flags [S.], seq 3690906216, ack 1, win 29200, options [mss 1460], length 0
09:52:26.907614 IP kolbin.65535 > 172.18.0.4.20002: Flags [R], seq 0, win 32678, length 0
09:52:27.527847 IP kolbin.65535 > 172.18.0.4.20002: Flags [S], seq 0, win 32678, length 0
09:52:27.528224 IP 172.18.0.4.20002 > kolbin.65535: Flags [S.], seq 3690906216, ack 1, win 29200, options [mss 1460], length 0
09:52:27.731523 IP kolbin.65535 > 172.18.0.4.20002: Flags [R], seq 0, win 32678, length 0
09:52:28.546932 IP 172.18.0.4.20002 > kolbin.65535: Flags [S.], seq 3690906216, ack 1, win 29200, options [mss 1460], length 0
09:52:28.546981 IP kolbin.65535 > 172.18.0.4.20002: Flags [R], seq 1, win 0, length 0
09:52:28.755863 IP kolbin.65535 > 172.18.0.4.20002: Flags [S], seq 0, win 32678, length 0
09:52:28.756299 IP 172.18.0.4.20002 > kolbin.65535: Flags [S.], seq 3722970538, ack 1, win 29200, options [mss 1460], length 0
09:52:28.959643 IP kolbin.65535 > 172.18.0.4.20002: Flags [R], seq 0, win 32678, length 0
09:52:29.571739 IP kolbin.65535 > 172.18.0.4.20002: Flags [S], seq 0, win 32678, length 0
09:52:29.571978 IP 172.18.0.4.20002 > kolbin.65535: Flags [S.], seq 3722970538, ack 1, win 29200, options [mss 1460], length 0
09:52:29.664233 IP 172.18.0.4.20002 > kolbin.49236: Flags [F.], seq 243, ack 55, win 227, options [nop,nop,TS val 1468865287 ecr 4207200375], length 0
09:52:29.775683 IP kolbin.65535 > 172.18.0.4.20002: Flags [R], seq 0, win 32678, length 0
09:52:29.871042 IP 172.18.0.4.20002 > kolbin.49236: Flags [F.], seq 243, ack 55, win 227, options [nop,nop,TS val 1468865339 ecr 4207200375], length 0
09:52:30.079151 IP 172.18.0.4.20002 > kolbin.49236: Flags [F.], seq 243, ack 55, win 227, options [nop,nop,TS val 1468865391 ecr 4207200375], length 0
09:52:30.079442 IP kolbin.49236 > 172.18.0.4.20002: Flags [F.], seq 55, ack 244, win 501, options [nop,nop,TS val 4207205796 ecr 1468865391], length 0
09:52:30.079930 IP 172.18.0.4.20002 > kolbin.49236: Flags [.], ack 56, win 227, options [nop,nop,TS val 1468865391 ecr 4207205796], length 0
09:52:30.594917 IP 172.18.0.4.20002 > kolbin.65535: Flags [S.], seq 3722970538, ack 1, win 29200, options [mss 1460], length 0
09:52:30.594974 IP kolbin.65535 > 172.18.0.4.20002: Flags [R], seq 1, win 0, length 0
09:52:30.796081 IP kolbin.65535 > 172.18.0.4.20002: Flags [S], seq 0, win 32678, length 0
09:52:30.796391 IP 172.18.0.4.20002 > kolbin.65535: Flags [S.], seq 3754848062, ack 1, win 29200, options [mss 1460], length 0
09:52:30.999493 IP kolbin.65535 > 172.18.0.4.20002: Flags [R], seq 0, win 32678, length 0
09:52:31.619718 IP kolbin.65535 > 172.18.0.4.20002: Flags [S], seq 0, win 32678, length 0
09:52:31.620132 IP 172.18.0.4.20002 > kolbin.65535: Flags [S.], seq 3754848062, ack 1, win 29200, options [mss 1460], length 0
09:52:31.823672 IP kolbin.65535 > 172.18.0.4.20002: Flags [R], seq 0, win 32678, length 0
09:52:32.643063 IP 172.18.0.4.20002 > kolbin.65535: Flags [S.], seq 3754848062, ack 1, win 29200, options [mss 1460], length 0
09:52:32.644013 IP kolbin.65535 > 172.18.0.4.20002: Flags [S], seq 0, win 32678, length 0
09:52:32.644219 IP 172.18.0.4.20002 > kolbin.65535: Flags [S.], seq 3754848062, ack 1, win 29200, options [mss 1460], length 0
09:52:32.847132 IP kolbin.65535 > 172.18.0.4.20002: Flags [R], seq 0, win 32678, length 0
09:52:34.659362 IP 172.18.0.4.20002 > kolbin.65535: Flags [S.], seq 3754848062, ack 1, win 29200, options [mss 1460], length 0
09:52:38.851064 IP 172.18.0.4.20002 > kolbin.65535: Flags [S.], seq 3754848062, ack 1, win 29200, options [mss 1460], length 0
09:52:47.043257 IP 172.18.0.4.20002 > kolbin.65535: Flags [S.], seq 3754848062, ack 1, win 29200, options [mss 1460], length 0
09:52:47.043308 IP kolbin.65535 > 172.18.0.4.20002: Flags [R], seq 1, win 0, length 0
```

**Comment by guyharris** [comment]
>  I doubt if libpcap intercepts packets and discards them

It does not do so.  It receives packets via a separate code path from the regular networking stack, so it does not prevent packets from being processed by the networking stack.
